{
  "abstentionCaseCount": 10,
  "artifactVersion": "s12.dense-hard.v2-lineage.v1",
  "authorIneligibleForCandidate": true,
  "caseCount": 28,
  "datasetKind": "SYNTHETIC_NON_PRODUCTION",
  "entityAssertions": 113,
  "fullAbstentionCaseCount": 6,
  "goldDigest": "sha256:da295ae2f50832972a115d003f7fdbde3bbf517390751b9d51947d1b369068a7",
  "lineageDigest": "sha256:9517da45082cd8ab84c0c7a02792f7785e380417105eef18ae3a9d9d7aa2da3f",
  "manifestDigest": "sha256:255c4bdd0e20c3fa4c245703ef1c1105e7f80ea51349edcc431f3ab32efb5313",
  "noReuseChecks": {
    "caseIdsDisjoint": true,
    "normalizedSentencesDisjoint": true,
    "rawTextChanged": true,
    "sourceDigestsDisjoint": true,
    "sourcePayloadDigestFresh": true
  },
  "nonClaims": [
    "No v2 candidate, score, review, provider, human, external, held-out, production, selection, promotion, or release result is present."
  ],
  "partialAbstentionCaseCount": 4,
  "protocolDigest": "sha256:ab9dc5639b87487f4087cd9f36d8ab29aaec17e8eeb2269c4642a8c145f4aa55",
  "providerCalls": 0,
  "relationAssertions": 49,
  "sliceCount": 21,
  "sourcePayloadDigest": "sha256:c5ca7a63ecb16a96e2801ecedc5b20bb02c34705305b301a119ee6f9c05a4232",
  "status": "VALIDATED_FRESH_NO_V1_REUSE",
  "v1SourcePayloadDigest": "sha256:65e6a044767f97298dee4511d19e3373878483224b9b7cf2606b94acdefc1409"
}
